{
    "metadata": {
      "generated_at": "2025-02-22T14:30:00Z",
      "version": "1.0.0",
      "source": "Test Data Generator"
    },
    "users": [
      {
        "id": "a1b2c3d4-e5f6-7890-1234-56789abcdef0",
        "name": "John Doe",
        "email": "johndoe@example.com",
        "profile": {
          "age": 34,
          "gender": "male",
          "preferences": {
            "newsletter": true,
            "notifications": ["email", "sms"],
            "theme": "dark"
          },
          "security": {
            "password_last_changed": "2024-12-30T10:15:00Z",
            "multi_factor_enabled": true,
            "login_attempts": [
              {"timestamp": "2025-02-21T12:00:00Z", "success": true},
              {"timestamp": "2025-02-21T12:05:00Z", "success": false}
            ]
          }
        },
        "addresses": [
          {
            "type": "home",
            "street": "123 Elm St",
            "city": "Springfield",
            "state": "IL",
            "zip": "62704",
            "country": "USA",
            "geo": {"lat": 39.7817, "lng": -89.6501}
          },
          {
            "type": "work",
            "street": "456 Oak St",
            "city": "Chicago",
            "state": "IL",
            "zip": "60601",
            "country": "USA",
            "geo": {"lat": 41.8781, "lng": -87.6298}
          }
        ],
        "orders": [
          {
            "order_id": "ORD-001",
            "date": "2025-01-15T08:45:30Z",
            "items": [
              {
                "product_id": "P-12345",
                "name": "Laptop",
                "category": "Electronics",
                "price": 999.99,
                "quantity": 1,
                "warranty": {"duration": "2 years", "coverage": "full"}
              },
              {
                "product_id": "P-67890",
                "name": "Wireless Mouse",
                "category": "Accessories",
                "price": 49.99,
                "quantity": 2,
                "warranty": {"duration": "1 year", "coverage": "limited"}
              }
            ],
            "total": 1099.97,
            "status": "shipped",
            "shipping_details": {
              "carrier": "UPS",
              "tracking_number": "1Z9999W99999999999",
              "estimated_delivery": "2025-01-20T12:00:00Z"
            }
          }
        ]
      }
    ],
    "products": [
      {
        "id": "P-12345",
        "name": "Laptop",
        "category": "Electronics",
        "price": 999.99,
        "stock": 50,
        "ratings": {
          "average": 4.7,
          "reviews": 120
        },
        "specifications": {
          "processor": "Intel Core i7",
          "ram": "16GB",
          "storage": "512GB SSD"
        }
      }
    ],
    "transactions": [
      {
        "transaction_id": "T-0001",
        "user_id": "a1b2c3d4-e5f6-7890-1234-56789abcdef0",
        "order_id": "ORD-001",
        "payment_method": "credit_card",
        "amount": 1099.97,
        "status": "completed",
        "timestamp": "2025-01-15T08:50:00Z",
        "fraud_check": {
          "risk_score": 5,
          "flags": ["new_device", "high_amount"]
        }
      }
    ],
    "logs": [
      {
        "timestamp": "2025-02-21T12:00:00Z",
        "level": "INFO",
        "message": "User logged in",
        "user_id": "a1b2c3d4-e5f6-7890-1234-56789abcdef0"
      },
      {
        "timestamp": "2025-02-21T12:05:30Z",
        "level": "ERROR",
        "message": "Payment processing failed",
        "details": {
          "order_id": "ORD-002",
          "error_code": "PAY-001",
          "description": "Insufficient funds"
        }
      }
    ]
  }
  